{
  "session_id": "3f1c2b9e-6a1d-4c55-9a0e-2b7d4f8e1a10",
  "agent": "railmon",
  "capture_start": "2026-10-02T17:00:00.000Z",
  "interactions": [
    {
      "timestamp": "2026-10-02T17:00:01.250Z",
      "pid": 4021,
      "tid": 4033,
      "request_size": 512,
      "response_size": 4096,
      "request": {
        "method": "POST",
        "path": "/v1/messages",
        "headers": {
          "host": "api.anthropic.com",
          "content-type": "application/json",
          "x-rail": "eyJhZ2VudF9pZCI6IjY4NTRlYjA0LTZhMmYtNGI5OS04M2E3LWRiOGQ2NWNhZTRlYSJ9"
        },
        "body": {
          "model": "claude-sonnet",
          "max_tokens": 64
        }
      },
      "response": {
        "status_code": 200,
        "headers": {
          "content-type": "text/event-stream"
        },
        "body": {
          "raw": "event: message_start"
        },
        "is_sse": true
      },
      "latency_ms": 503.0,
      "idempotency_key": "railmon-0cf69dfedd549e73a79559612e234447fab17101"
    },
    {
      "timestamp": "2026-10-02T17:00:02.000Z",
      "pid": 4100,
      "tid": 4100,
      "request_size": 120,
      "response_size": 2048,
      "request": {
        "method": "GET",
        "path": "/repos/datrail/railmon",
        "headers": {
          "host": "api.github.com"
        }
      },
      "response": {
        "status_code": 200,
        "headers": {
          "content-type": "application/json"
        },
        "body": {
          "id": 1
        }
      },
      "latency_ms": 88.5,
      "idempotency_key": "railmon-5b2e0c4d9f8a7e6d5c4b3a291807f6e5d4c3b2a1",
      "runtime_identity_version": 1,
      "agent_ref": {
        "host_id": "host-01",
        "sandbox_name": "shared-agents",
        "agent_key": "planner"
      },
      "attribution": {
        "state": "attributed",
        "method": "process_target",
        "target_id": "planner",
        "process": {
          "pid": 4100,
          "start_time_ticks": 123456
        }
      }
    },
    {
      "timestamp": "2026-10-02T17:00:03.000Z",
      "pid": 4200,
      "tid": 4201,
      "request_size": 0,
      "response_size": 0,
      "response": {
        "status_code": 204
      },
      "idempotency_key": "railmon-9a8b7c6d5e4f3a2b1c0d9e8f7a6b5c4d3e2f1a0b",
      "runtime_identity_version": 1,
      "agent_ref": null,
      "attribution": {
        "state": "unknown",
        "reason": "PROCESS_INCARNATION_UNPINNED",
        "target_id": "executor",
        "process": null
      }
    }
  ]
}
